{
  "chain": [
    "n01315ee",
    "n0126971",
    "n01191d0"
  ],
  "name": "查找器者",
  "nodes": {
    "n01191d0": {
      "type": "tpl_click",
      "x": 184.0,
      "y": 230.0,
      "title": "找模板点击",
      "props": {
        "threshold": 0.75,
        "roi": "",
        "order_by": "Score",
        "timeout": 5000,
        "rate_limit": 0,
        "pre_delay": 0,
        "post_delay": 800,
        "post_wait_freezes": 0,
        "repeat": 1,
        "repeat_delay": 350,
        "template": "蛙锣.png"
      },
      "num": 1
    },
    "n0126971": {
      "type": "swipe",
      "x": 230.0,
      "y": 368.0,
      "title": "滑动",
      "props": {
        "x1": 1219,
        "y1": 377,
        "x2": 59,
        "y2": 364,
        "duration": 900,
        "repeat": 1,
        "repeat_delay": 350,
        "pre_wait_freezes": 0,
        "post_wait_freezes": 0,
        "post_delay": 600
      },
      "num": 2,
      "next": "n01315ee"
    },
    "n01315ee": {
      "type": "branch",
      "x": 184.0,
      "y": 92.0,
      "title": "分支",
      "props": {
        "threshold": 0.75,
        "ocr_text": "",
        "roi": "",
        "timeout": 5000,
        "rate_limit": 0,
        "template": "蛙锣.png"
      },
      "num": 3,
      "hit_next": "n01191d0",
      "miss_next": "n0126971"
    },
    "n006d49b": {
      "type": "input",
      "x": 690.0,
      "y": 138.0,
      "title": "输入",
      "props": {
        "option": "角色名",
        "var": "",
        "var_label": "",
        "kind": "文本",
        "default": "",
        "desc": "",
        "raw": "",
        "field": "模板图 (template)",
        "value": "",
        "verify": "",
        "pattern_msg": "",
        "targets": [
          "n01315ee",
          "n01191d0"
        ]
      },
      "num": 5
    }
  },
  "schemaVersion": 4
}