{
  "name": "启动",
  "chain": [
    "n0018d7f",
    "n0025701",
    "n0067984",
    "n002c32e",
    "n003882b",
    "n0081576",
    "n0094d42",
    "n010ccd9",
    "n011b55e",
    "n0130b97"
  ],
  "nodes": {
    "n0018d7f": {
      "type": "startapp",
      "x": 138.0,
      "y": 46.0,
      "title": "启动游戏",
      "props": {
        "package": "com.cipaishe.wuhua.bilibili",
        "post_delay": 25000
      },
      "num": 1,
      "next": "n0025701"
    },
    "n002c32e": {
      "type": "tpl_click",
      "x": 506.0,
      "y": 322.0,
      "title": "找模板点击",
      "props": {
        "threshold": 0.8,
        "roi": "1135,62,90,62",
        "timeout": 8000,
        "rate_limit": 0,
        "pre_delay": 0,
        "post_delay": 800,
        "post_wait_freezes": 0,
        "repeat": 1,
        "repeat_delay": 350,
        "template": "ks_cha.png"
      },
      "num": 2,
      "next": "n003882b"
    },
    "n003882b": {
      "type": "tap",
      "x": 138.0,
      "y": 552.0,
      "title": "固定坐标点击",
      "props": {
        "x": 611,
        "y": 361,
        "pre_delay": 0,
        "post_delay": 6000,
        "post_wait_freezes": 0,
        "repeat": 1,
        "repeat_delay": 350
      },
      "num": 3,
      "next": "n0081576"
    },
    "n0081576": {
      "type": "branch",
      "x": 138.0,
      "y": 644.0,
      "title": "分支",
      "props": {
        "threshold": 0.7,
        "ocr_text": "",
        "roi": "",
        "timeout": 3000,
        "rate_limit": 0,
        "template": "wu.png"
      },
      "num": 5,
      "hit_next": "n0094d42",
      "miss_next": "n011b55e"
    },
    "n0094d42": {
      "type": "tap",
      "x": 138.0,
      "y": 782.0,
      "title": "固定坐标点击",
      "props": {
        "x": 640,
        "y": 360,
        "pre_delay": 0,
        "post_delay": 0,
        "post_wait_freezes": 0,
        "repeat": 1,
        "repeat_delay": 350
      },
      "num": 6,
      "next": "n010ccd9"
    },
    "n010ccd9": {
      "type": "tpl_click",
      "x": 138.0,
      "y": 874.0,
      "title": "找模板点击",
      "props": {
        "threshold": 0.85,
        "roi": "",
        "timeout": 8000,
        "rate_limit": 0,
        "pre_delay": 0,
        "post_delay": 6000,
        "post_wait_freezes": 100,
        "repeat": 1,
        "repeat_delay": 350,
        "template": "qd_cha.png"
      },
      "num": 7,
      "next": "n011b55e"
    },
    "n011b55e": {
      "type": "branch",
      "x": 138.0,
      "y": 1012.0,
      "title": "分支",
      "props": {
        "threshold": 0.8,
        "ocr_text": "",
        "roi": "",
        "timeout": 3000,
        "rate_limit": 200,
        "template": "tc_cha.png"
      },
      "num": 8,
      "hit_next": "n0130b97",
      "miss_next": null
    },
    "n0130b97": {
      "type": "tpl_click",
      "x": 552.0,
      "y": 1012.0,
      "title": "找模板点击",
      "props": {
        "threshold": 0.8,
        "roi": "",
        "timeout": 8000,
        "rate_limit": 200,
        "pre_delay": 0,
        "post_delay": 800,
        "post_wait_freezes": 0,
        "repeat": 1,
        "repeat_delay": 350,
        "template": "tc_cha.png"
      },
      "num": 9,
      "next": "n011b55e"
    },
    "n0067984": {
      "type": "branch",
      "x": 138.0,
      "y": 368.0,
      "title": "分支",
      "props": {
        "threshold": 0.7,
        "ocr_text": "",
        "roi": "1141,67,68,55",
        "timeout": 3000,
        "rate_limit": 0,
        "template": "ks_cha.png"
      },
      "num": 10,
      "hit_next": "n002c32e",
      "miss_next": "n0025701",
      "next": "n002c32e"
    },
    "n0025701": {
      "type": "branch",
      "x": 138.0,
      "y": 184.0,
      "title": "分支",
      "props": {
        "threshold": 0.7,
        "ocr_text": "",
        "roi": "",
        "timeout": 3000,
        "rate_limit": 0,
        "template": "ks_cha.png"
      },
      "num": 11,
      "hit_next": "n0067984",
      "miss_next": "n0067984",
      "next": "n0067984"
    }
  },
  "schemaVersion": 4
}